{
  "schema_version": 1,
  "version": 1,
  "parent_hash": null,
  "team_hash": "348b58c3ab32d0c7887b9033e380fc1bdd5e4562b18c6c29930ccf906c6f0018",
  "team": {
    "schema_version": 3,
    "repo": "git@github.com:jack506255560/codex-collab.git",
    "base_branch": "codex/automatic-wecom-agent",
    "reviewer": "xuym",
    "default_route": "frontend",
    "agents": {
      "xuym": {
        "role": "admin",
        "capabilities": [
          "frontend",
          "backend"
        ],
        "max_concurrent_tasks": 1,
        "public_key": "-----BEGIN PUBLIC KEY-----\nMCowBQYDK2VwAyEAEtFN3IN4fmnyHo6QFg/ChzX5/smiGA4Zwd2xXd2dotI=\n-----END PUBLIC KEY-----\n",
        "wecom_userid": "woFyLUCAAARyLpTbzdGRCCG62Cqeiz9Q"
      }
    },
    "routes": {
      "frontend": [
        "xuym"
      ],
      "backend": [
        "xuym"
      ]
    },
    "policy": {
      "claim_timeout_ms": 180000,
      "lease_ms": 900000,
      "clock_skew_ms": 5000,
      "max_attempts": 3
    },
    "review_rules": {
      "frontend": {
        "required": true,
        "reviewer": "owner",
        "notify": "owner"
      },
      "backend": {
        "required": true,
        "reviewer": "owner",
        "notify": "owner"
      }
    }
  },
  "actor_id": "xuym",
  "signature": "gIF42uhD0FxyM0Ce2F9Nyyjt8aiohNUNyUl0v+Gdqi/jWh7G0PTRHg1KY2WtlGUn711gytyy4UejcyJT4zC8Dg=="
}
